<?xml version="1.0" encoding="UTF-8"?>

<Order
    xmlns:xsi="http://www.w3.org/2001/XMLSchema-instance"
    xsi:noNamespaceSchemaLocation="question2.xsd">

    <Shiporder orderid="1">

        <Orderby>
            <Ordername></Ordername>
            <Orderphone>987654321</Orderphone>
            <Orderdate>2024-08-01</Orderdate>
        </Orderby>

        <Shipto>
            <Name></Name>

            <Shipaddress>
                <Street></Street>
                <Houseno></Houseno>
                <Municipality></Municipality>
                <City></City>
                <District></District>
                <Country></Country>
                <Postalcode>1234567891</Postalcode>
                <Telephone>12345678</Telephone>
                <Mobile>123456789</Mobile>
            </Shipaddress>

        </Shipto>

        <Orderitem>
            <Itemnumber>77</Itemnumber>
            <Itemname></Itemname>
            <Itemnote></Itemnote>
            <ItemInsurance>Yes</ItemInsurance>
            <Itemquantity>5</Itemquantity>
            <Currency>USD</Currency>
            <Itemunitprice>45.6</Itemunitprice>
            <Shipcharge>4.4</Shipcharge>
            <Totalprice>50.0</Totalprice>
        </Orderitem>

    </Shiporder>


</Order>


<!-- Validation Rules:
-
 Use the data type as the Element name suggests. Elements must appear in
proper sequence.
-
 Shiporder & Orderitem can appear multiple times.
-
 Orderid & Postalcode must not contain more than 10 characters & it must be
positive integer.
-
 ‘Telephone’ & ‘Mobile’ must be 7 to 15 character long positive integer.
-
 Either one child element or another can appear in case of VDC & Municipality.
If no country is specified ‘Nepal’ should be placed.
-
 ‘Itemnote’ is optional. Currency must contain 3 characters, uppercase A-Z.
-
 ‘ItemInsurance’ contains data either ‘Yes’ or ‘No’. -->